,passage,question,text
454,إن قارون كان من قوم موسى فبغى عليهم وآتيناه من الكنوز ما إن مفاتحه لتنوء بالعصبة أولي القوة إذ قال له قومه لا تفرح إن الله لا يحب الفرحين. وابتغ فيما آتاك الله الدار الآخرة ولا تنس نصيبك من الدنيا وأحسن كما أحسن الله إليك ولا تبغ الفساد في الأرض إن الله لا يحب المفسدين. قال إنما أوتيته على علم عندي أولم يعلم أن الله قد أهلك من قبله من القرون من هو أشد منه قوة وأكثر جمعا ولا يسأل عن ذنوبهم المجرمون. فخرج على قومه في زينته قال الذين يريدون الحياة الدنيا يا ليت لنا مثل ما أوتي قارون إنه لذو حظ عظيم. وقال الذين أوتوا العلم ويلكم ثواب الله خير لمن آمن وعمل صالحا ولا يلقاها إلا الصابرون. فخسفنا به وبداره الأرض فما كان له من فئة ينصرونه من دون الله وما كان من المنتصرين.,من هم المحسنون؟,ابتغ فيما آتاك الله الدار الآخرة ولا تنس نصيبك من الدنيا وأحسن كما أحسن الله إليك
455,ولئن سألتهم من خلق السماوات والأرض وسخر الشمس والقمر ليقولن الله فأنى يؤفكون. الله يبسط الرزق لمن يشاء من عباده ويقدر له إن الله بكل شيء عليم. ولئن سألتهم من نزل من السماء ماء فأحيا به الأرض من بعد موتها ليقولن الله قل الحمد لله بل أكثرهم لا يعقلون. وما هذه الحياة الدنيا إلا لهو ولعب وإن الدار الآخرة لهي الحيوان لو كانوا يعلمون. فإذا ركبوا في الفلك دعوا الله مخلصين له الدين فلما نجاهم إلى البر إذا هم يشركون. ليكفروا بما آتيناهم وليتمتعوا فسوف يعلمون. أولم يروا أنا جعلنا حرما آمنا ويتخطف الناس من حولهم أفبالباطل يؤمنون وبنعمة الله يكفرون. ومن أظلم ممن افترى على الله كذبا أو كذب بالحق لما جاءه أليس في جهنم مثوى للكافرين. والذين جاهدوا فينا لنهدينهم سبلنا وإن الله لمع المحسنين.,من هم المحسنون؟,الذين جاهدوا فينا
456,يا أيها النبي قل لأزواجك إن كنتن تردن الحياة الدنيا وزينتها فتعالين أمتعكن وأسرحكن سراحا جميلا. وإن كنتن تردن الله ورسوله والدار الآخرة فإن الله أعد للمحسنات منكن أجرا عظيما. يا نساء النبي من يأت منكن بفاحشة مبينة يضاعف لها العذاب ضعفين وكان ذلك على الله يسيرا. ومن يقنت منكن لله ورسوله وتعمل صالحا نؤتها أجرها مرتين وأعتدنا لها رزقا كريما.,من هم المحسنون؟,تردن الله ورسوله والدار الآخرة
457,ولقد نادانا نوح فلنعم المجيبون. ونجيناه وأهله من الكرب العظيم. وجعلنا ذريته هم الباقين. وتركنا عليه في الآخرين. سلام على نوح في العالمين. إنا كذلك نجزي المحسنين. إنه من عبادنا المؤمنين. ثم أغرقنا الآخرين.,من هم المحسنون؟,نوح
458,وقال إني ذاهب إلى ربي سيهدين. رب هب لي من الصالحين. فبشرناه بغلام حليم. فلما بلغ معه السعي قال يا بني إني أرى في المنام أني أذبحك فانظر ماذا ترى قال يا أبت افعل ما تؤمر ستجدني إن شاء الله من الصابرين. فلما أسلما وتله للجبين. وناديناه أن يا إبراهيم. قد صدقت الرؤيا إنا كذلك نجزي المحسنين. إن هذا لهو البلاء المبين. وفديناه بذبح عظيم. وتركنا عليه في الآخرين. سلام على إبراهيم. كذلك نجزي المحسنين. إنه من عبادنا المؤمنين. وبشرناه بإسحاق نبيا من الصالحين. وباركنا عليه وعلى إسحاق ومن ذريتهما محسن وظالم لنفسه مبين.,من هم المحسنون؟,إبراهيم
459,وقال إني ذاهب إلى ربي سيهدين. رب هب لي من الصالحين. فبشرناه بغلام حليم. فلما بلغ معه السعي قال يا بني إني أرى في المنام أني أذبحك فانظر ماذا ترى قال يا أبت افعل ما تؤمر ستجدني إن شاء الله من الصابرين. فلما أسلما وتله للجبين. وناديناه أن يا إبراهيم. قد صدقت الرؤيا إنا كذلك نجزي المحسنين. إن هذا لهو البلاء المبين. وفديناه بذبح عظيم. وتركنا عليه في الآخرين. سلام على إبراهيم. كذلك نجزي المحسنين. إنه من عبادنا المؤمنين. وبشرناه بإسحاق نبيا من الصالحين. وباركنا عليه وعلى إسحاق ومن ذريتهما محسن وظالم لنفسه مبين.,من هم المحسنون؟,إبراهيم
460,ولقد مننا على موسى وهارون. ونجيناهما وقومهما من الكرب العظيم. ونصرناهم فكانوا هم الغالبين. وآتيناهما الكتاب المستبين. وهديناهما الصراط المستقيم. وتركنا عليهما في الآخرين. سلام على موسى وهارون. إنا كذلك نجزي المحسنين. إنهما من عبادنا المؤمنين.,من هم المحسنون؟,موسى
461,ولقد مننا على موسى وهارون. ونجيناهما وقومهما من الكرب العظيم. ونصرناهم فكانوا هم الغالبين. وآتيناهما الكتاب المستبين. وهديناهما الصراط المستقيم. وتركنا عليهما في الآخرين. سلام على موسى وهارون. إنا كذلك نجزي المحسنين. إنهما من عبادنا المؤمنين.,من هم المحسنون؟,هارون
462,وإن إلياس لمن المرسلين. إذ قال لقومه ألا تتقون. أتدعون بعلا وتذرون أحسن الخالقين. الله ربكم ورب آبائكم الأولين. فكذبوه فإنهم لمحضرون. إلا عباد الله المخلصين. وتركنا عليه في الآخرين. سلام على إل ياسين. إنا كذلك نجزي المحسنين. إنه من عبادنا المؤمنين.,من هم المحسنون؟,إل ياسين
463,أمن هو قانت آناء الليل ساجدا وقائما يحذر الآخرة ويرجو رحمة ربه قل هل يستوي الذين يعلمون والذين لا يعلمون إنما يتذكر أولو الألباب. قل يا عباد الذين آمنوا اتقوا ربكم للذين أحسنوا في هذه الدنيا حسنة وأرض الله واسعة إنما يوفى الصابرون أجرهم بغير حساب.,من هم المحسنون؟,قل يا عباد الذين آمنوا اتقوا ربكم
464,فمن أظلم ممن كذب على الله وكذب بالصدق إذ جاءه أليس في جهنم مثوى للكافرين. والذي جاء بالصدق وصدق به أولئك هم المتقون. لهم ما يشاءون عند ربهم ذلك جزاء المحسنين. ليكفر الله عنهم أسوأ الذي عملوا ويجزيهم أجرهم بأحسن الذي كانوا يعملون. أليس الله بكاف عبده ويخوفونك بالذين من دونه ومن يضلل الله فما له من هاد. ومن يهد الله فما له من مضل أليس الله بعزيز ذي انتقام.,من هم المحسنون؟,الذي جاء بالصدق وصدق به أولئك هم المتقون
465,ومن أحسن قولا ممن دعا إلى الله وعمل صالحا وقال إنني من المسلمين. ولا تستوي الحسنة ولا السيئة ادفع بالتي هي أحسن فإذا الذي بينك وبينه عداوة كأنه ولي حميم. وما يلقاها إلا الذين صبروا وما يلقاها إلا ذو حظ عظيم. وإما ينزغنك من الشيطان نزغ فاستعذ بالله إنه هو السميع العليم.,من هم المحسنون؟,من دعا إلى الله وعمل صالحا وقال إنني من المسلمين
466,ولله ما في السماوات وما في الأرض ليجزي الذين أساءوا بما عملوا ويجزي الذين أحسنوا بالحسنى. الذين يجتنبون كبائر الإثم والفواحش إلا اللمم إن ربك واسع المغفرة هو أعلم بكم إذ أنشأكم من الأرض وإذ أنتم أجنة في بطون أمهاتكم فلا تزكوا أنفسكم هو أعلم بمن اتقى. أفرأيت الذي تولى. وأعطى قليلا وأكدى. أعنده علم الغيب فهو يرى. أم لم ينبأ بما في صحف موسى. وإبراهيم الذي وفى. ألا تزر وازرة وزر أخرى. وأن ليس للإنسان إلا ما سعى. وأن سعيه سوف يرى. ثم يجزاه الجزاء الأوفى.,من هم المحسنون؟,الذين يجتنبون كبائر الإثم والفواحش إلا اللمم
467,فلما فصل طالوت بالجنود قال إن الله مبتليكم بنهر فمن شرب منه فليس مني ومن لم يطعمه فإنه مني إلا من اغترف غرفة بيده فشربوا منه إلا قليلا منهم فلما جاوزه هو والذين آمنوا معه قالوا لا طاقة لنا اليوم بجالوت وجنوده قال الذين يظنون أنهم ملاقو الله كم من فئة قليلة غلبت فئة كثيرة بإذن الله والله مع الصابرين. ولما برزوا لجالوت وجنوده قالوا ربنا أفرغ علينا صبرا وثبت أقدامنا وانصرنا على القوم الكافرين. فهزموهم بإذن الله وقتل داوود جالوت وآتاه الله الملك والحكمة وعلمه مما يشاء ولولا دفع الله الناس بعضهم ببعض لفسدت الأرض ولكن الله ذو فضل على العالمين. تلك آيات الله نتلوها عليك بالحق وإنك لمن المرسلين.,ما هي الأحداث المتعلقة بداوود عليه السلام؟,قتل داوود جالوت وآتاه الله الملك والحكمة وعلمه مما يشاء
468,إنا أوحينا إليك كما أوحينا إلى نوح والنبيين من بعده وأوحينا إلى إبراهيم وإسماعيل وإسحاق ويعقوب والأسباط وعيسى وأيوب ويونس وهارون وسليمان وآتينا داوود زبورا. ورسلا قد قصصناهم عليك من قبل ورسلا لم نقصصهم عليك وكلم الله موسى تكليما. رسلا مبشرين ومنذرين لئلا يكون للناس على الله حجة بعد الرسل وكان الله عزيزا حكيما. لكن الله يشهد بما أنزل إليك أنزله بعلمه والملائكة يشهدون وكفى بالله شهيدا.,ما هي الأحداث المتعلقة بداوود عليه السلام؟,وآتينا داوود زبورا
469,وقل لعبادي يقولوا التي هي أحسن إن الشيطان ينزغ بينهم إن الشيطان كان للإنسان عدوا مبينا. ربكم أعلم بكم إن يشأ يرحمكم أو إن يشأ يعذبكم وما أرسلناك عليهم وكيلا. وربك أعلم بمن في السماوات والأرض ولقد فضلنا بعض النبيين على بعض وآتينا داوود زبورا. قل ادعوا الذين زعمتم من دونه فلا يملكون كشف الضر عنكم ولا تحويلا.,ما هي الأحداث المتعلقة بداوود عليه السلام؟,آتينا داوود زبورا
470,وداوود وسليمان إذ يحكمان في الحرث إذ نفشت فيه غنم القوم وكنا لحكمهم شاهدين. ففهمناها سليمان وكلا آتينا حكما وعلما وسخرنا مع داوود الجبال يسبحن والطير وكنا فاعلين. وعلمناه صنعة لبوس لكم لتحصنكم من بأسكم فهل أنتم شاكرون. ولسليمان الريح عاصفة تجري بأمره إلى الأرض التي باركنا فيها وكنا بكل شيء عالمين. ومن الشياطين من يغوصون له ويعملون عملا دون ذلك وكنا لهم حافظين.,ما هي الأحداث المتعلقة بداوود عليه السلام؟,داوود وسليمان إذ يحكمان في الحرث إذ نفشت فيه غنم القوم وكنا لحكمهم شاهدين. ففهمناها سليمان وكلا آتينا حكما وعلما وسخرنا مع داوود الجبال يسبحن والطير وكنا فاعلين. وعلمناه صنعة لبوس لكم لتحصنكم من بأسكم
471,ولقد آتينا داوود وسليمان علما وقالا الحمد لله الذي فضلنا على كثير من عباده المؤمنين. وورث سليمان داوود وقال يا أيها الناس علمنا منطق الطير وأوتينا من كل شيء إن هذا لهو الفضل المبين. وحشر لسليمان جنوده من الجن والإنس والطير فهم يوزعون. حتى إذا أتوا على واد النمل قالت نملة يا أيها النمل ادخلوا مساكنكم لا يحطمنكم سليمان وجنوده وهم لا يشعرون. فتبسم ضاحكا من قولها وقال رب أوزعني أن أشكر نعمتك التي أنعمت علي وعلى والدي وأن أعمل صالحا ترضاه وأدخلني برحمتك في عبادك الصالحين. وتفقد الطير فقال ما لي لا أرى الهدهد أم كان من الغائبين. لأعذبنه عذابا شديدا أو لأذبحنه أو ليأتيني بسلطان مبين. فمكث غير بعيد فقال أحطت بما لم تحط به وجئتك من سبإ بنبإ يقين.,ما هي الأحداث المتعلقة بداوود عليه السلام؟,لقد آتينا داوود وسليمان علما
472,ولقد آتينا داوود وسليمان علما وقالا الحمد لله الذي فضلنا على كثير من عباده المؤمنين. وورث سليمان داوود وقال يا أيها الناس علمنا منطق الطير وأوتينا من كل شيء إن هذا لهو الفضل المبين. وحشر لسليمان جنوده من الجن والإنس والطير فهم يوزعون. حتى إذا أتوا على واد النمل قالت نملة يا أيها النمل ادخلوا مساكنكم لا يحطمنكم سليمان وجنوده وهم لا يشعرون. فتبسم ضاحكا من قولها وقال رب أوزعني أن أشكر نعمتك التي أنعمت علي وعلى والدي وأن أعمل صالحا ترضاه وأدخلني برحمتك في عبادك الصالحين. وتفقد الطير فقال ما لي لا أرى الهدهد أم كان من الغائبين. لأعذبنه عذابا شديدا أو لأذبحنه أو ليأتيني بسلطان مبين. فمكث غير بعيد فقال أحطت بما لم تحط به وجئتك من سبإ بنبإ يقين.,ما هي الأحداث المتعلقة بداوود عليه السلام؟,قالا الحمد لله الذي فضلنا على كثير من عباده المؤمنين
473,ولقد آتينا داوود وسليمان علما وقالا الحمد لله الذي فضلنا على كثير من عباده المؤمنين. وورث سليمان داوود وقال يا أيها الناس علمنا منطق الطير وأوتينا من كل شيء إن هذا لهو الفضل المبين. وحشر لسليمان جنوده من الجن والإنس والطير فهم يوزعون. حتى إذا أتوا على واد النمل قالت نملة يا أيها النمل ادخلوا مساكنكم لا يحطمنكم سليمان وجنوده وهم لا يشعرون. فتبسم ضاحكا من قولها وقال رب أوزعني أن أشكر نعمتك التي أنعمت علي وعلى والدي وأن أعمل صالحا ترضاه وأدخلني برحمتك في عبادك الصالحين. وتفقد الطير فقال ما لي لا أرى الهدهد أم كان من الغائبين. لأعذبنه عذابا شديدا أو لأذبحنه أو ليأتيني بسلطان مبين. فمكث غير بعيد فقال أحطت بما لم تحط به وجئتك من سبإ بنبإ يقين.,ما هي الأحداث المتعلقة بداوود عليه السلام؟,وورث سليمان داوود
474,ولقد آتينا داوود منا فضلا يا جبال أوبي معه والطير وألنا له الحديد. أن اعمل سابغات وقدر في السرد واعملوا صالحا إني بما تعملون بصير. ولسليمان الريح غدوها شهر ورواحها شهر وأسلنا له عين القطر ومن الجن من يعمل بين يديه بإذن ربه ومن يزغ منهم عن أمرنا نذقه من عذاب السعير. يعملون له ما يشاء من محاريب وتماثيل وجفان كالجواب وقدور راسيات اعملوا آل داوود شكرا وقليل من عبادي الشكور.,ما هي الأحداث المتعلقة بداوود عليه السلام؟,لقد آتينا داوود منا فضلا يا جبال أوبي معه والطير وألنا له الحديد. أن اعمل سابغات وقدر في السرد
475,ولقد آتينا داوود منا فضلا يا جبال أوبي معه والطير وألنا له الحديد. أن اعمل سابغات وقدر في السرد واعملوا صالحا إني بما تعملون بصير. ولسليمان الريح غدوها شهر ورواحها شهر وأسلنا له عين القطر ومن الجن من يعمل بين يديه بإذن ربه ومن يزغ منهم عن أمرنا نذقه من عذاب السعير. يعملون له ما يشاء من محاريب وتماثيل وجفان كالجواب وقدور راسيات اعملوا آل داوود شكرا وقليل من عبادي الشكور.,ما هي الأحداث المتعلقة بداوود عليه السلام؟,اعملوا آل داوود شكرا
476,كذبت قبلهم قوم نوح وعاد وفرعون ذو الأوتاد. وثمود وقوم لوط وأصحاب الأيكة أولئك الأحزاب. إن كل إلا كذب الرسل فحق عقاب. وما ينظر هؤلاء إلا صيحة واحدة ما لها من فواق. وقالوا ربنا عجل لنا قطنا قبل يوم الحساب. اصبر على ما يقولون واذكر عبدنا داوود ذا الأيد إنه أواب. إنا سخرنا الجبال معه يسبحن بالعشي والإشراق. والطير محشورة كل له أواب. وشددنا ملكه وآتيناه الحكمة وفصل الخطاب.,ما هي الأحداث المتعلقة بداوود عليه السلام؟,إنه أواب. إنا سخرنا الجبال معه يسبحن بالعشي والإشراق. والطير محشورة كل له أواب. وشددنا ملكه وآتيناه الحكمة وفصل الخطاب
477,وهل أتاك نبأ الخصم إذ تسوروا المحراب. إذ دخلوا على داوود ففزع منهم قالوا لا تخف خصمان بغى بعضنا على بعض فاحكم بيننا بالحق ولا تشطط واهدنا إلى سواء الصراط. إن هذا أخي له تسع وتسعون نعجة ولي نعجة واحدة فقال أكفلنيها وعزني في الخطاب. قال لقد ظلمك بسؤال نعجتك إلى نعاجه وإن كثيرا من الخلطاء ليبغي بعضهم على بعض إلا الذين آمنوا وعملوا الصالحات وقليل ما هم وظن داوود أنما فتناه فاستغفر ربه وخر راكعا وأناب. فغفرنا له ذلك وإن له عندنا لزلفى وحسن مآب. يا داوود إنا جعلناك خليفة في الأرض فاحكم بين الناس بالحق ولا تتبع الهوى فيضلك عن سبيل الله إن الذين يضلون عن سبيل الله لهم عذاب شديد بما نسوا يوم الحساب.,ما هي الأحداث المتعلقة بداوود عليه السلام؟,هل أتاك نبأ الخصم إذ تسوروا المحراب. إذ دخلوا على داوود ففزع منهم قالوا لا تخف خصمان بغى بعضنا على بعض فاحكم بيننا بالحق ولا تشطط واهدنا إلى سواء الصراط. إن هذا أخي له تسع وتسعون نعجة ولي نعجة واحدة فقال أكفلنيها وعزني في الخطاب. قال لقد ظلمك بسؤال نعجتك إلى نعاجه وإن كثيرا من الخلطاء ليبغي بعضهم على بعض إلا الذين آمنوا وعملوا الصالحات وقليل ما هم وظن داوود أنما فتناه فاستغفر ربه وخر راكعا وأناب. فغفرنا له ذلك وإن له عندنا لزلفى وحسن مآب. يا داوود إنا جعلناك خليفة في الأرض فاحكم بين الناس بالحق ولا تتبع الهوى فيضلك عن سبيل الله
478,ووهبنا لداوود سليمان نعم العبد إنه أواب. إذ عرض عليه بالعشي الصافنات الجياد. فقال إني أحببت حب الخير عن ذكر ربي حتى توارت بالحجاب. ردوها علي فطفق مسحا بالسوق والأعناق. ولقد فتنا سليمان وألقينا على كرسيه جسدا ثم أناب. قال رب اغفر لي وهب لي ملكا لا ينبغي لأحد من بعدي إنك أنت الوهاب. فسخرنا له الريح تجري بأمره رخاء حيث أصاب. والشياطين كل بناء وغواص. وآخرين مقرنين في الأصفاد. هذا عطاؤنا فامنن أو أمسك بغير حساب. وإن له عندنا لزلفى وحسن مآب.,ما هي الأحداث المتعلقة بداوود عليه السلام؟,وهبنا لداوود سليمان
479,فلما فصل طالوت بالجنود قال إن الله مبتليكم بنهر فمن شرب منه فليس مني ومن لم يطعمه فإنه مني إلا من اغترف غرفة بيده فشربوا منه إلا قليلا منهم فلما جاوزه هو والذين آمنوا معه قالوا لا طاقة لنا اليوم بجالوت وجنوده قال الذين يظنون أنهم ملاقو الله كم من فئة قليلة غلبت فئة كثيرة بإذن الله والله مع الصابرين. ولما برزوا لجالوت وجنوده قالوا ربنا أفرغ علينا صبرا وثبت أقدامنا وانصرنا على القوم الكافرين. فهزموهم بإذن الله وقتل داوود جالوت وآتاه الله الملك والحكمة وعلمه مما يشاء ولولا دفع الله الناس بعضهم ببعض لفسدت الأرض ولكن الله ذو فضل على العالمين. تلك آيات الله نتلوها عليك بالحق وإنك لمن المرسلين.,من هو النبي الذي عايش طالوت؟,داوود
480,لا إكراه في الدين قد تبين الرشد من الغي فمن يكفر بالطاغوت ويؤمن بالله فقد استمسك بالعروة الوثقى لا انفصام لها والله سميع عليم. الله ولي الذين آمنوا يخرجهم من الظلمات إلى النور والذين كفروا أولياؤهم الطاغوت يخرجونهم من النور إلى الظلمات أولئك أصحاب النار هم فيها خالدون.,اتهم القرآن بأنه السبب في الدكتاتورية الإسلامية لكونه أباح التكفير وقتال الكفار حتى يسلموا، كيف نرد على ذلك؟,لا إكراه في الدين
