,passage,question,text
649,وإذا قرئ القرآن فاستمعوا له وأنصتوا لعلكم ترحمون. واذكر ربك في نفسك تضرعا وخيفة ودون الجهر من القول بالغدو والآصال ولا تكن من الغافلين. إن الذين عند ربك لا يستكبرون عن عبادته ويسبحونه وله يسجدون.,هل ورد في القرآن إشارة لصوت ذي تأثير إيجابي على جسم الإنسان؟,إذا قرئ القرآن فاستمعوا له وأنصتوا لعلكم ترحمون
650,قل إني أمرت أن أعبد الله مخلصا له الدين. وأمرت لأن أكون أول المسلمين. قل إني أخاف إن عصيت ربي عذاب يوم عظيم. قل الله أعبد مخلصا له ديني. فاعبدوا ما شئتم من دونه قل إن الخاسرين الذين خسروا أنفسهم وأهليهم يوم القيامة ألا ذلك هو الخسران المبين. لهم من فوقهم ظلل من النار ومن تحتهم ظلل ذلك يخوف الله به عباده يا عباد فاتقون. والذين اجتنبوا الطاغوت أن يعبدوها وأنابوا إلى الله لهم البشرى فبشر عباد. الذين يستمعون القول فيتبعون أحسنه أولئك الذين هداهم الله وأولئك هم أولو الألباب. أفمن حق عليه كلمة العذاب أفأنت تنقذ من في النار. لكن الذين اتقوا ربهم لهم غرف من فوقها غرف مبنية تجري من تحتها الأنهار وعد الله لا يخلف الله الميعاد.,هل ورد في القرآن إشارة لصوت ذي تأثير إيجابي على جسم الإنسان؟,الذين يستمعون القول فيتبعون أحسنه أولئك الذين هداهم الله
651,وكم أهلكنا قبلهم من قرن هم أشد منهم بطشا فنقبوا في البلاد هل من محيص. إن في ذلك لذكرى لمن كان له قلب أو ألقى السمع وهو شهيد. ولقد خلقنا السماوات والأرض وما بينهما في ستة أيام وما مسنا من لغوب. فاصبر على ما يقولون وسبح بحمد ربك قبل طلوع الشمس وقبل الغروب. ومن الليل فسبحه وأدبار السجود. واستمع يوم يناد المناد من مكان قريب. يوم يسمعون الصيحة بالحق ذلك يوم الخروج. إنا نحن نحيي ونميت وإلينا المصير. يوم تشقق الأرض عنهم سراعا ذلك حشر علينا يسير. نحن أعلم بما يقولون وما أنت عليهم بجبار فذكر بالقرآن من يخاف وعيد.,هل ورد في القرآن إشارة لصوت ذي تأثير إيجابي على جسم الإنسان؟,إن في ذلك لذكرى لمن كان له قلب أو ألقى السمع وهو شهيد
652,يا أيها الذين آمنوا إذا نودي للصلاة من يوم الجمعة فاسعوا إلى ذكر الله وذروا البيع ذلكم خير لكم إن كنتم تعلمون. فإذا قضيت الصلاة فانتشروا في الأرض وابتغوا من فضل الله واذكروا الله كثيرا لعلكم تفلحون. وإذا رأوا تجارة أو لهوا انفضوا إليها وتركوك قائما قل ما عند الله خير من اللهو ومن التجارة والله خير الرازقين.,هل ورد في القرآن إشارة لصوت ذي تأثير إيجابي على جسم الإنسان؟,يا أيها الذين آمنوا إذا نودي للصلاة من يوم الجمعة فاسعوا إلى ذكر الله
653,لا يؤاخذكم الله باللغو في أيمانكم ولكن يؤاخذكم بما عقدتم الأيمان فكفارته إطعام عشرة مساكين من أوسط ما تطعمون أهليكم أو كسوتهم أو تحرير رقبة فمن لم يجد فصيام ثلاثة أيام ذلك كفارة أيمانكم إذا حلفتم واحفظوا أيمانكم كذلك يبين الله لكم آياته لعلكم تشكرون.,ما هي كفارة اليمين؟,إطعام عشرة مساكين من أوسط ما تطعمون أهليكم أو كسوتهم أو تحرير رقبة فمن لم يجد فصيام ثلاثة أيام
654,يا أيها الذين آمنوا لا تسألوا عن أشياء إن تبد لكم تسؤكم وإن تسألوا عنها حين ينزل القرآن تبد لكم عفا الله عنها والله غفور حليم. قد سألها قوم من قبلكم ثم أصبحوا بها كافرين.,مع أن السؤال هو أساس كل العلوم، لماذا نهى الله المؤمنين عن طرح الأسئلة كما جاء في سورة المائدة آية 101؟,إن تبد لكم تسؤكم وإن تسألوا عنها حين ينزل القرآن تبد لكم عفا الله عنها والله غفور حليم. قد سألها قوم من قبلكم ثم أصبحوا بها كافرين
655,يا أيها الذين آمنوا شهادة بينكم إذا حضر أحدكم الموت حين الوصية اثنان ذوا عدل منكم أو آخران من غيركم إن أنتم ضربتم في الأرض فأصابتكم مصيبة الموت تحبسونهما من بعد الصلاة فيقسمان بالله إن ارتبتم لا نشتري به ثمنا ولو كان ذا قربى ولا نكتم شهادة الله إنا إذا لمن الآثمين. فإن عثر على أنهما استحقا إثما فآخران يقومان مقامهما من الذين استحق عليهم الأوليان فيقسمان بالله لشهادتنا أحق من شهادتهما وما اعتدينا إنا إذا لمن الظالمين. ذلك أدنى أن يأتوا بالشهادة على وجهها أو يخافوا أن ترد أيمان بعد أيمانهم واتقوا الله واسمعوا والله لا يهدي القوم الفاسقين.,ما هي الآيات التي تتحدث عن موضوع الوصية في سورة المائدة؟,يا أيها الذين آمنوا شهادة بينكم إذا حضر أحدكم الموت حين الوصية اثنان ذوا عدل منكم أو آخران من غيركم إن أنتم ضربتم في الأرض فأصابتكم مصيبة الموت تحبسونهما من بعد الصلاة فيقسمان بالله إن ارتبتم لا نشتري به ثمنا ولو كان ذا قربى ولا نكتم شهادة الله إنا إذا لمن الآثمين
656,يا أيها الذين آمنوا شهادة بينكم إذا حضر أحدكم الموت حين الوصية اثنان ذوا عدل منكم أو آخران من غيركم إن أنتم ضربتم في الأرض فأصابتكم مصيبة الموت تحبسونهما من بعد الصلاة فيقسمان بالله إن ارتبتم لا نشتري به ثمنا ولو كان ذا قربى ولا نكتم شهادة الله إنا إذا لمن الآثمين. فإن عثر على أنهما استحقا إثما فآخران يقومان مقامهما من الذين استحق عليهم الأوليان فيقسمان بالله لشهادتنا أحق من شهادتهما وما اعتدينا إنا إذا لمن الظالمين. ذلك أدنى أن يأتوا بالشهادة على وجهها أو يخافوا أن ترد أيمان بعد أيمانهم واتقوا الله واسمعوا والله لا يهدي القوم الفاسقين.,ما هي الآيات التي تتحدث عن موضوع الوصية في سورة المائدة؟,فإن عثر على أنهما استحقا إثما فآخران يقومان مقامهما من الذين استحق عليهم الأوليان فيقسمان بالله لشهادتنا أحق من شهادتهما وما اعتدينا إنا إذا لمن الظالمين
657,يا أيها الذين آمنوا شهادة بينكم إذا حضر أحدكم الموت حين الوصية اثنان ذوا عدل منكم أو آخران من غيركم إن أنتم ضربتم في الأرض فأصابتكم مصيبة الموت تحبسونهما من بعد الصلاة فيقسمان بالله إن ارتبتم لا نشتري به ثمنا ولو كان ذا قربى ولا نكتم شهادة الله إنا إذا لمن الآثمين. فإن عثر على أنهما استحقا إثما فآخران يقومان مقامهما من الذين استحق عليهم الأوليان فيقسمان بالله لشهادتنا أحق من شهادتهما وما اعتدينا إنا إذا لمن الظالمين. ذلك أدنى أن يأتوا بالشهادة على وجهها أو يخافوا أن ترد أيمان بعد أيمانهم واتقوا الله واسمعوا والله لا يهدي القوم الفاسقين.,ما هي الآيات التي تتحدث عن موضوع الوصية في سورة المائدة؟,ذلك أدنى أن يأتوا بالشهادة على وجهها أو يخافوا أن ترد أيمان بعد أيمانهم
658,وحاجه قومه قال أتحاجوني في الله وقد هدان ولا أخاف ما تشركون به إلا أن يشاء ربي شيئا وسع ربي كل شيء علما أفلا تتذكرون. وكيف أخاف ما أشركتم ولا تخافون أنكم أشركتم بالله ما لم ينزل به عليكم سلطانا فأي الفريقين أحق بالأمن إن كنتم تعلمون. الذين آمنوا ولم يلبسوا إيمانهم بظلم أولئك لهم الأمن وهم مهتدون. وتلك حجتنا آتيناها إبراهيم على قومه نرفع درجات من نشاء إن ربك حكيم عليم. ووهبنا له إسحاق ويعقوب كلا هدينا ونوحا هدينا من قبل ومن ذريته داوود وسليمان وأيوب ويوسف وموسى وهارون وكذلك نجزي المحسنين. وزكريا ويحيى وعيسى وإلياس كل من الصالحين. وإسماعيل واليسع ويونس ولوطا وكلا فضلنا على العالمين.,من هم أبناء سيدنا ابراهيم عليه السلام؟,إسحاق
659,وحاجه قومه قال أتحاجوني في الله وقد هدان ولا أخاف ما تشركون به إلا أن يشاء ربي شيئا وسع ربي كل شيء علما أفلا تتذكرون. وكيف أخاف ما أشركتم ولا تخافون أنكم أشركتم بالله ما لم ينزل به عليكم سلطانا فأي الفريقين أحق بالأمن إن كنتم تعلمون. الذين آمنوا ولم يلبسوا إيمانهم بظلم أولئك لهم الأمن وهم مهتدون. وتلك حجتنا آتيناها إبراهيم على قومه نرفع درجات من نشاء إن ربك حكيم عليم. ووهبنا له إسحاق ويعقوب كلا هدينا ونوحا هدينا من قبل ومن ذريته داوود وسليمان وأيوب ويوسف وموسى وهارون وكذلك نجزي المحسنين. وزكريا ويحيى وعيسى وإلياس كل من الصالحين. وإسماعيل واليسع ويونس ولوطا وكلا فضلنا على العالمين.,من هم أبناء سيدنا ابراهيم عليه السلام؟,إسماعيل
660,ولقد جاءت رسلنا إبراهيم بالبشرى قالوا سلاما قال سلام فما لبث أن جاء بعجل حنيذ. فلما رأى أيديهم لا تصل إليه نكرهم وأوجس منهم خيفة قالوا لا تخف إنا أرسلنا إلى قوم لوط. وامرأته قائمة فضحكت فبشرناها بإسحاق ومن وراء إسحاق يعقوب. قالت يا ويلتى أألد وأنا عجوز وهذا بعلي شيخا إن هذا لشيء عجيب. قالوا أتعجبين من أمر الله رحمت الله وبركاته عليكم أهل البيت إنه حميد مجيد. فلما ذهب عن إبراهيم الروع وجاءته البشرى يجادلنا في قوم لوط. إن إبراهيم لحليم أواه منيب. يا إبراهيم أعرض عن هذا إنه قد جاء أمر ربك وإنهم آتيهم عذاب غير مردود.,من هم أبناء سيدنا ابراهيم عليه السلام؟,إسحاق
661,وإذ قال إبراهيم رب اجعل هذا البلد آمنا واجنبني وبني أن نعبد الأصنام. رب إنهن أضللن كثيرا من الناس فمن تبعني فإنه مني ومن عصاني فإنك غفور رحيم. ربنا إني أسكنت من ذريتي بواد غير ذي زرع عند بيتك المحرم ربنا ليقيموا الصلاة فاجعل أفئدة من الناس تهوي إليهم وارزقهم من الثمرات لعلهم يشكرون. ربنا إنك تعلم ما نخفي وما نعلن وما يخفى على الله من شيء في الأرض ولا في السماء. الحمد لله الذي وهب لي على الكبر إسماعيل وإسحاق إن ربي لسميع الدعاء. رب اجعلني مقيم الصلاة ومن ذريتي ربنا وتقبل دعاء. ربنا اغفر لي ولوالدي وللمؤمنين يوم يقوم الحساب.,من هم أبناء سيدنا ابراهيم عليه السلام؟,إسماعيل
662,وإذ قال إبراهيم رب اجعل هذا البلد آمنا واجنبني وبني أن نعبد الأصنام. رب إنهن أضللن كثيرا من الناس فمن تبعني فإنه مني ومن عصاني فإنك غفور رحيم. ربنا إني أسكنت من ذريتي بواد غير ذي زرع عند بيتك المحرم ربنا ليقيموا الصلاة فاجعل أفئدة من الناس تهوي إليهم وارزقهم من الثمرات لعلهم يشكرون. ربنا إنك تعلم ما نخفي وما نعلن وما يخفى على الله من شيء في الأرض ولا في السماء. الحمد لله الذي وهب لي على الكبر إسماعيل وإسحاق إن ربي لسميع الدعاء. رب اجعلني مقيم الصلاة ومن ذريتي ربنا وتقبل دعاء. ربنا اغفر لي ولوالدي وللمؤمنين يوم يقوم الحساب.,من هم أبناء سيدنا ابراهيم عليه السلام؟,إسحاق
663,واذكر في الكتاب إبراهيم إنه كان صديقا نبيا. إذ قال لأبيه يا أبت لم تعبد ما لا يسمع ولا يبصر ولا يغني عنك شيئا. يا أبت إني قد جاءني من العلم ما لم يأتك فاتبعني أهدك صراطا سويا. يا أبت لا تعبد الشيطان إن الشيطان كان للرحمن عصيا. يا أبت إني أخاف أن يمسك عذاب من الرحمن فتكون للشيطان وليا. قال أراغب أنت عن آلهتي يا إبراهيم لئن لم تنته لأرجمنك واهجرني مليا. قال سلام عليك سأستغفر لك ربي إنه كان بي حفيا. وأعتزلكم وما تدعون من دون الله وأدعو ربي عسى ألا أكون بدعاء ربي شقيا. فلما اعتزلهم وما يعبدون من دون الله وهبنا له إسحاق ويعقوب وكلا جعلنا نبيا. ووهبنا لهم من رحمتنا وجعلنا لهم لسان صدق عليا. واذكر في الكتاب موسى إنه كان مخلصا وكان رسولا نبيا.,من هم أبناء سيدنا ابراهيم عليه السلام؟,إسحاق ويعقوب
664,وقال إني ذاهب إلى ربي سيهدين. رب هب لي من الصالحين. فبشرناه بغلام حليم. فلما بلغ معه السعي قال يا بني إني أرى في المنام أني أذبحك فانظر ماذا ترى قال يا أبت افعل ما تؤمر ستجدني إن شاء الله من الصابرين. فلما أسلما وتله للجبين. وناديناه أن يا إبراهيم. قد صدقت الرؤيا إنا كذلك نجزي المحسنين. إن هذا لهو البلاء المبين. وفديناه بذبح عظيم. وتركنا عليه في الآخرين. سلام على إبراهيم. كذلك نجزي المحسنين. إنه من عبادنا المؤمنين. وبشرناه بإسحاق نبيا من الصالحين. وباركنا عليه وعلى إسحاق ومن ذريتهما محسن وظالم لنفسه مبين.,من هم أبناء سيدنا ابراهيم عليه السلام؟,إسحاق
665,ووهبنا له إسحاق ويعقوب كلا هدينا ونوحا هدينا من قبل ومن ذريته داوود وسليمان وأيوب ويوسف وموسى وهارون وكذلك نجزي المحسنين. وزكريا ويحيى وعيسى وإلياس كل من الصالحين. وإسماعيل واليسع ويونس ولوطا وكلا فضلنا على العالمين. ومن آبائهم وذرياتهم وإخوانهم واجتبيناهم وهديناهم إلى صراط مستقيم. ذلك هدى الله يهدي به من يشاء من عباده ولو أشركوا لحبط عنهم ما كانوا يعملون. أولئك الذين آتيناهم الكتاب والحكم والنبوة فإن يكفر بها هؤلاء فقد وكلنا بها قوما ليسوا بها بكافرين. أولئك الذين هدى الله فبهداهم اقتده قل لا أسألكم عليه أجرا إن هو إلا ذكرى للعالمين.,هل كان سيدنا يوسف عليه السلام رسولا أم نبيا؟,أولئك الذين آتيناهم الكتاب والحكم والنبوة
666,ولقد جاءكم يوسف من قبل بالبينات فما زلتم في شك مما جاءكم به حتى إذا هلك قلتم لن يبعث الله من بعده رسولا كذلك يضل الله من هو مسرف مرتاب. الذين يجادلون في آيات الله بغير سلطان أتاهم كبر مقتا عند الله وعند الذين آمنوا كذلك يطبع الله على كل قلب متكبر جبار.,هل كان سيدنا يوسف عليه السلام رسولا أم نبيا؟,رسولا
667,فمن يرد الله أن يهديه يشرح صدره للإسلام ومن يرد أن يضله يجعل صدره ضيقا حرجا كأنما يصعد في السماء كذلك يجعل الله الرجس على الذين لا يؤمنون. وهذا صراط ربك مستقيما قد فصلنا الآيات لقوم يذكرون. لهم دار السلام عند ربهم وهو وليهم بما كانوا يعملون.,هل أشار القرآن الى نقص الأكسجين في المرتفعات؟,من يرد الله أن يهديه يشرح صدره للإسلام ومن يرد أن يضله يجعل صدره ضيقا حرجا كأنما يصعد في السماء
668,إن ربكم الله الذي خلق السماوات والأرض في ستة أيام ثم استوى على العرش يغشي الليل النهار يطلبه حثيثا والشمس والقمر والنجوم مسخرات بأمره ألا له الخلق والأمر تبارك الله رب العالمين. ادعوا ربكم تضرعا وخفية إنه لا يحب المعتدين. ولا تفسدوا في الأرض بعد إصلاحها وادعوه خوفا وطمعا إن رحمت الله قريب من المحسنين.,في كم يوم خلق الله الكون؟,ستة أيام
669,إن ربكم الله الذي خلق السماوات والأرض في ستة أيام ثم استوى على العرش يدبر الأمر ما من شفيع إلا من بعد إذنه ذلكم الله ربكم فاعبدوه أفلا تذكرون. إليه مرجعكم جميعا وعد الله حقا إنه يبدأ الخلق ثم يعيده ليجزي الذين آمنوا وعملوا الصالحات بالقسط والذين كفروا لهم شراب من حميم وعذاب أليم بما كانوا يكفرون. هو الذي جعل الشمس ضياء والقمر نورا وقدره منازل لتعلموا عدد السنين والحساب ما خلق الله ذلك إلا بالحق يفصل الآيات لقوم يعلمون. إن في اختلاف الليل والنهار وما خلق الله في السماوات والأرض لآيات لقوم يتقون.,في كم يوم خلق الله الكون؟,ستة أيام
670,وما من دابة في الأرض إلا على الله رزقها ويعلم مستقرها ومستودعها كل في كتاب مبين. وهو الذي خلق السماوات والأرض في ستة أيام وكان عرشه على الماء ليبلوكم أيكم أحسن عملا ولئن قلت إنكم مبعوثون من بعد الموت ليقولن الذين كفروا إن هذا إلا سحر مبين.,في كم يوم خلق الله الكون؟,ستة أيام
671,وما أرسلناك إلا مبشرا ونذيرا. قل ما أسألكم عليه من أجر إلا من شاء أن يتخذ إلى ربه سبيلا. وتوكل على الحي الذي لا يموت وسبح بحمده وكفى به بذنوب عباده خبيرا. الذي خلق السماوات والأرض وما بينهما في ستة أيام ثم استوى على العرش الرحمن فاسأل به خبيرا. وإذا قيل لهم اسجدوا للرحمن قالوا وما الرحمن أنسجد لما تأمرنا وزادهم نفورا. تبارك الذي جعل في السماء بروجا وجعل فيها سراجا وقمرا منيرا. وهو الذي جعل الليل والنهار خلفة لمن أراد أن يذكر أو أراد شكورا.,في كم يوم خلق الله الكون؟,ستة أيام
672,الله الذي خلق السماوات والأرض وما بينهما في ستة أيام ثم استوى على العرش ما لكم من دونه من ولي ولا شفيع أفلا تتذكرون. يدبر الأمر من السماء إلى الأرض ثم يعرج إليه في يوم كان مقداره ألف سنة مما تعدون. ذلك عالم الغيب والشهادة العزيز الرحيم. الذي أحسن كل شيء خلقه وبدأ خلق الإنسان من طين. ثم جعل نسله من سلالة من ماء مهين. ثم سواه ونفخ فيه من روحه وجعل لكم السمع والأبصار والأفئدة قليلا ما تشكرون.,في كم يوم خلق الله الكون؟,ستة أيام
673,قل أئنكم لتكفرون بالذي خلق الأرض في يومين وتجعلون له أندادا ذلك رب العالمين. وجعل فيها رواسي من فوقها وبارك فيها وقدر فيها أقواتها في أربعة أيام سواء للسائلين. ثم استوى إلى السماء وهي دخان فقال لها وللأرض ائتيا طوعا أو كرها قالتا أتينا طائعين. فقضاهن سبع سماوات في يومين وأوحى في كل سماء أمرها وزينا السماء الدنيا بمصابيح وحفظا ذلك تقدير العزيز العليم.,في كم يوم خلق الله الكون؟,قل أئنكم لتكفرون بالذي خلق الأرض في يومين وتجعلون له أندادا ذلك رب العالمين. وجعل فيها رواسي من فوقها وبارك فيها وقدر فيها أقواتها في أربعة أيام سواء للسائلين. ثم استوى إلى السماء وهي دخان فقال لها وللأرض ائتيا طوعا أو كرها قالتا أتينا طائعين. فقضاهن سبع سماوات في يومين وأوحى في كل سماء أمرها
674,وكم أهلكنا قبلهم من قرن هم أشد منهم بطشا فنقبوا في البلاد هل من محيص. إن في ذلك لذكرى لمن كان له قلب أو ألقى السمع وهو شهيد. ولقد خلقنا السماوات والأرض وما بينهما في ستة أيام وما مسنا من لغوب. فاصبر على ما يقولون وسبح بحمد ربك قبل طلوع الشمس وقبل الغروب. ومن الليل فسبحه وأدبار السجود. واستمع يوم يناد المناد من مكان قريب. يوم يسمعون الصيحة بالحق ذلك يوم الخروج. إنا نحن نحيي ونميت وإلينا المصير. يوم تشقق الأرض عنهم سراعا ذلك حشر علينا يسير. نحن أعلم بما يقولون وما أنت عليهم بجبار فذكر بالقرآن من يخاف وعيد.,في كم يوم خلق الله الكون؟,ستة أيام
