,passage,question,text
234,قل آمنا بالله وما أنزل علينا وما أنزل على إبراهيم وإسماعيل وإسحاق ويعقوب والأسباط وما أوتي موسى وعيسى والنبيون من ربهم لا نفرق بين أحد منهم ونحن له مسلمون. ومن يبتغ غير الإسلام دينا فلن يقبل منه وهو في الآخرة من الخاسرين.,من هم الأنبياء الذين ذكروا في القرآن على أنهم مسلمون؟,يعقوب
235,قل آمنا بالله وما أنزل علينا وما أنزل على إبراهيم وإسماعيل وإسحاق ويعقوب والأسباط وما أوتي موسى وعيسى والنبيون من ربهم لا نفرق بين أحد منهم ونحن له مسلمون. ومن يبتغ غير الإسلام دينا فلن يقبل منه وهو في الآخرة من الخاسرين.,من هم الأنبياء الذين ذكروا في القرآن على أنهم مسلمون؟,موسى
236,قل آمنا بالله وما أنزل علينا وما أنزل على إبراهيم وإسماعيل وإسحاق ويعقوب والأسباط وما أوتي موسى وعيسى والنبيون من ربهم لا نفرق بين أحد منهم ونحن له مسلمون. ومن يبتغ غير الإسلام دينا فلن يقبل منه وهو في الآخرة من الخاسرين.,من هم الأنبياء الذين ذكروا في القرآن على أنهم مسلمون؟,عيسى
237,واتل عليهم نبأ نوح إذ قال لقومه يا قوم إن كان كبر عليكم مقامي وتذكيري بآيات الله فعلى الله توكلت فأجمعوا أمركم وشركاءكم ثم لا يكن أمركم عليكم غمة ثم اقضوا إلي ولا تنظرون. فإن توليتم فما سألتكم من أجر إن أجري إلا على الله وأمرت أن أكون من المسلمين. فكذبوه فنجيناه ومن معه في الفلك وجعلناهم خلائف وأغرقنا الذين كذبوا بآياتنا فانظر كيف كان عاقبة المنذرين.,من هم الأنبياء الذين ذكروا في القرآن على أنهم مسلمون؟,نوح
238,قالوا يا أبانا استغفر لنا ذنوبنا إنا كنا خاطئين. قال سوف أستغفر لكم ربي إنه هو الغفور الرحيم. فلما دخلوا على يوسف آوى إليه أبويه وقال ادخلوا مصر إن شاء الله آمنين. ورفع أبويه على العرش وخروا له سجدا وقال يا أبت هذا تأويل رؤياي من قبل قد جعلها ربي حقا وقد أحسن بي إذ أخرجني من السجن وجاء بكم من البدو من بعد أن نزغ الشيطان بيني وبين إخوتي إن ربي لطيف لما يشاء إنه هو العليم الحكيم. رب قد آتيتني من الملك وعلمتني من تأويل الأحاديث فاطر السماوات والأرض أنت وليي في الدنيا والآخرة توفني مسلما وألحقني بالصالحين.,من هم الأنبياء الذين ذكروا في القرآن على أنهم مسلمون؟,يوسف
239,قال يا أيها الملأ أيكم يأتيني بعرشها قبل أن يأتوني مسلمين. قال عفريت من الجن أنا آتيك به قبل أن تقوم من مقامك وإني عليه لقوي أمين. قال الذي عنده علم من الكتاب أنا آتيك به قبل أن يرتد إليك طرفك فلما رآه مستقرا عنده قال هذا من فضل ربي ليبلوني أأشكر أم أكفر ومن شكر فإنما يشكر لنفسه ومن كفر فإن ربي غني كريم. قال نكروا لها عرشها ننظر أتهتدي أم تكون من الذين لا يهتدون. فلما جاءت قيل أهكذا عرشك قالت كأنه هو وأوتينا العلم من قبلها وكنا مسلمين. وصدها ما كانت تعبد من دون الله إنها كانت من قوم كافرين. قيل لها ادخلي الصرح فلما رأته حسبته لجة وكشفت عن ساقيها قال إنه صرح ممرد من قوارير قالت رب إني ظلمت نفسي وأسلمت مع سليمان لله رب العالمين.,من هم الأنبياء الذين ذكروا في القرآن على أنهم مسلمون؟,سليمان
240,ومن يرغب عن ملة إبراهيم إلا من سفه نفسه ولقد اصطفيناه في الدنيا وإنه في الآخرة لمن الصالحين. إذ قال له ربه أسلم قال أسلمت لرب العالمين. ووصى بها إبراهيم بنيه ويعقوب يا بني إن الله اصطفى لكم الدين فلا تموتن إلا وأنتم مسلمون. أم كنتم شهداء إذ حضر يعقوب الموت إذ قال لبنيه ما تعبدون من بعدي قالوا نعبد إلهك وإله آبائك إبراهيم وإسماعيل وإسحاق إلها واحدا ونحن له مسلمون. تلك أمة قد خلت لها ما كسبت ولكم ما كسبتم ولا تسألون عما كانوا يعملون.,هل احترم الإسلام الأنبياء؟,ومن يرغب عن ملة إبراهيم إلا من سفه نفسه
241,ومن يرغب عن ملة إبراهيم إلا من سفه نفسه ولقد اصطفيناه في الدنيا وإنه في الآخرة لمن الصالحين. إذ قال له ربه أسلم قال أسلمت لرب العالمين. ووصى بها إبراهيم بنيه ويعقوب يا بني إن الله اصطفى لكم الدين فلا تموتن إلا وأنتم مسلمون. أم كنتم شهداء إذ حضر يعقوب الموت إذ قال لبنيه ما تعبدون من بعدي قالوا نعبد إلهك وإله آبائك إبراهيم وإسماعيل وإسحاق إلها واحدا ونحن له مسلمون. تلك أمة قد خلت لها ما كسبت ولكم ما كسبتم ولا تسألون عما كانوا يعملون.,هل احترم الإسلام الأنبياء؟,لقد اصطفيناه في الدنيا وإنه في الآخرة لمن الصالحين
242,وقالوا كونوا هودا أو نصارى تهتدوا قل بل ملة إبراهيم حنيفا وما كان من المشركين. قولوا آمنا بالله وما أنزل إلينا وما أنزل إلى إبراهيم وإسماعيل وإسحاق ويعقوب والأسباط وما أوتي موسى وعيسى وما أوتي النبيون من ربهم لا نفرق بين أحد منهم ونحن له مسلمون. فإن آمنوا بمثل ما آمنتم به فقد اهتدوا وإن تولوا فإنما هم في شقاق فسيكفيكهم الله وهو السميع العليم. صبغة الله ومن أحسن من الله صبغة ونحن له عابدون.,هل احترم الإسلام الأنبياء؟,قولوا آمنا بالله وما أنزل إلينا وما أنزل إلى إبراهيم وإسماعيل وإسحاق ويعقوب والأسباط وما أوتي موسى وعيسى وما أوتي النبيون من ربهم
243,وقالوا كونوا هودا أو نصارى تهتدوا قل بل ملة إبراهيم حنيفا وما كان من المشركين. قولوا آمنا بالله وما أنزل إلينا وما أنزل إلى إبراهيم وإسماعيل وإسحاق ويعقوب والأسباط وما أوتي موسى وعيسى وما أوتي النبيون من ربهم لا نفرق بين أحد منهم ونحن له مسلمون. فإن آمنوا بمثل ما آمنتم به فقد اهتدوا وإن تولوا فإنما هم في شقاق فسيكفيكهم الله وهو السميع العليم. صبغة الله ومن أحسن من الله صبغة ونحن له عابدون.,هل احترم الإسلام الأنبياء؟,لا نفرق بين أحد منهم
244,ليس البر أن تولوا وجوهكم قبل المشرق والمغرب ولكن البر من آمن بالله واليوم الآخر والملائكة والكتاب والنبيين وآتى المال على حبه ذوي القربى واليتامى والمساكين وابن السبيل والسائلين وفي الرقاب وأقام الصلاة وآتى الزكاة والموفون بعهدهم إذا عاهدوا والصابرين في البأساء والضراء وحين البأس أولئك الذين صدقوا وأولئك هم المتقون.,هل احترم الإسلام الأنبياء؟,البر من آمن بالله واليوم الآخر والملائكة والكتاب والنبيين
245,كان الناس أمة واحدة فبعث الله النبيين مبشرين ومنذرين وأنزل معهم الكتاب بالحق ليحكم بين الناس فيما اختلفوا فيه وما اختلف فيه إلا الذين أوتوه من بعد ما جاءتهم البينات بغيا بينهم فهدى الله الذين آمنوا لما اختلفوا فيه من الحق بإذنه والله يهدي من يشاء إلى صراط مستقيم. أم حسبتم أن تدخلوا الجنة ولما يأتكم مثل الذين خلوا من قبلكم مستهم البأساء والضراء وزلزلوا حتى يقول الرسول والذين آمنوا معه متى نصر الله ألا إن نصر الله قريب.,هل احترم الإسلام الأنبياء؟,بعث الله النبيين مبشرين ومنذرين وأنزل معهم الكتاب بالحق
246,تلك الرسل فضلنا بعضهم على بعض منهم من كلم الله ورفع بعضهم درجات وآتينا عيسى ابن مريم البينات وأيدناه بروح القدس ولو شاء الله ما اقتتل الذين من بعدهم من بعد ما جاءتهم البينات ولكن اختلفوا فمنهم من آمن ومنهم من كفر ولو شاء الله ما اقتتلوا ولكن الله يفعل ما يريد. يا أيها الذين آمنوا أنفقوا مما رزقناكم من قبل أن يأتي يوم لا بيع فيه ولا خلة ولا شفاعة والكافرون هم الظالمون.,هل احترم الإسلام الأنبياء؟,تلك الرسل فضلنا بعضهم على بعض منهم من كلم الله ورفع بعضهم درجات وآتينا عيسى ابن مريم البينات وأيدناه بروح القدس
247,لله ما في السماوات وما في الأرض وإن تبدوا ما في أنفسكم أو تخفوه يحاسبكم به الله فيغفر لمن يشاء ويعذب من يشاء والله على كل شيء قدير. آمن الرسول بما أنزل إليه من ربه والمؤمنون كل آمن بالله وملائكته وكتبه ورسله لا نفرق بين أحد من رسله وقالوا سمعنا وأطعنا غفرانك ربنا وإليك المصير. لا يكلف الله نفسا إلا وسعها لها ما كسبت وعليها ما اكتسبت ربنا لا تؤاخذنا إن نسينا أو أخطأنا ربنا ولا تحمل علينا إصرا كما حملته على الذين من قبلنا ربنا ولا تحملنا ما لا طاقة لنا به واعف عنا واغفر لنا وارحمنا أنت مولانا فانصرنا على القوم الكافرين.,هل احترم الإسلام الأنبياء؟,المؤمنون كل آمن بالله وملائكته وكتبه ورسله لا نفرق بين أحد من رسله
248,شهد الله أنه لا إله إلا هو والملائكة وأولو العلم قائما بالقسط لا إله إلا هو العزيز الحكيم. إن الدين عند الله الإسلام وما اختلف الذين أوتوا الكتاب إلا من بعد ما جاءهم العلم بغيا بينهم ومن يكفر بآيات الله فإن الله سريع الحساب. فإن حاجوك فقل أسلمت وجهي لله ومن اتبعن وقل للذين أوتوا الكتاب والأميين أأسلمتم فإن أسلموا فقد اهتدوا وإن تولوا فإنما عليك البلاغ والله بصير بالعباد. إن الذين يكفرون بآيات الله ويقتلون النبيين بغير حق ويقتلون الذين يأمرون بالقسط من الناس فبشرهم بعذاب أليم. أولئك الذين حبطت أعمالهم في الدنيا والآخرة وما لهم من ناصرين.,هل احترم الإسلام الأنبياء؟,إن الذين يكفرون بآيات الله ويقتلون النبيين بغير حق ويقتلون الذين يأمرون بالقسط من الناس فبشرهم بعذاب أليم
249,إن الله اصطفى آدم ونوحا وآل إبراهيم وآل عمران على العالمين. ذرية بعضها من بعض والله سميع عليم. إذ قالت امرأت عمران رب إني نذرت لك ما في بطني محررا فتقبل مني إنك أنت السميع العليم. فلما وضعتها قالت رب إني وضعتها أنثى والله أعلم بما وضعت وليس الذكر كالأنثى وإني سميتها مريم وإني أعيذها بك وذريتها من الشيطان الرجيم. فتقبلها ربها بقبول حسن وأنبتها نباتا حسنا وكفلها زكريا كلما دخل عليها زكريا المحراب وجد عندها رزقا قال يا مريم أنى لك هذا قالت هو من عند الله إن الله يرزق من يشاء بغير حساب. هنالك دعا زكريا ربه قال رب هب لي من لدنك ذرية طيبة إنك سميع الدعاء. فنادته الملائكة وهو قائم يصلي في المحراب أن الله يبشرك بيحيى مصدقا بكلمة من الله وسيدا وحصورا ونبيا من الصالحين. قال رب أنى يكون لي غلام وقد بلغني الكبر وامرأتي عاقر قال كذلك الله يفعل ما يشاء. قال رب اجعل لي آية قال آيتك ألا تكلم الناس ثلاثة أيام إلا رمزا واذكر ربك كثيرا وسبح بالعشي والإبكار.,هل احترم الإسلام الأنبياء؟,إن الله اصطفى آدم ونوحا وآل إبراهيم وآل عمران على العالمين
250,قل آمنا بالله وما أنزل علينا وما أنزل على إبراهيم وإسماعيل وإسحاق ويعقوب والأسباط وما أوتي موسى وعيسى والنبيون من ربهم لا نفرق بين أحد منهم ونحن له مسلمون. ومن يبتغ غير الإسلام دينا فلن يقبل منه وهو في الآخرة من الخاسرين.,هل احترم الإسلام الأنبياء؟,قل آمنا بالله وما أنزل علينا وما أنزل على إبراهيم وإسماعيل وإسحاق ويعقوب والأسباط وما أوتي موسى وعيسى والنبيون من ربهم
251,قل آمنا بالله وما أنزل علينا وما أنزل على إبراهيم وإسماعيل وإسحاق ويعقوب والأسباط وما أوتي موسى وعيسى والنبيون من ربهم لا نفرق بين أحد منهم ونحن له مسلمون. ومن يبتغ غير الإسلام دينا فلن يقبل منه وهو في الآخرة من الخاسرين.,هل احترم الإسلام الأنبياء؟,لا نفرق بين أحد منهم ونحن له مسلمون
252,ولو أنا كتبنا عليهم أن اقتلوا أنفسكم أو اخرجوا من دياركم ما فعلوه إلا قليل منهم ولو أنهم فعلوا ما يوعظون به لكان خيرا لهم وأشد تثبيتا. وإذا لآتيناهم من لدنا أجرا عظيما. ولهديناهم صراطا مستقيما. ومن يطع الله والرسول فأولئك مع الذين أنعم الله عليهم من النبيين والصديقين والشهداء والصالحين وحسن أولئك رفيقا. ذلك الفضل من الله وكفى بالله عليما.,هل احترم الإسلام الأنبياء؟,من يطع الله والرسول فأولئك مع الذين أنعم الله عليهم من النبيين والصديقين والشهداء والصالحين وحسن أولئك رفيقا
253,يا أيها الذين آمنوا كونوا قوامين بالقسط شهداء لله ولو على أنفسكم أو الوالدين والأقربين إن يكن غنيا أو فقيرا فالله أولى بهما فلا تتبعوا الهوى أن تعدلوا وإن تلووا أو تعرضوا فإن الله كان بما تعملون خبيرا. يا أيها الذين آمنوا آمنوا بالله ورسوله والكتاب الذي نزل على رسوله والكتاب الذي أنزل من قبل ومن يكفر بالله وملائكته وكتبه ورسله واليوم الآخر فقد ضل ضلالا بعيدا.,هل احترم الإسلام الأنبياء؟,من يكفر بالله وملائكته وكتبه ورسله واليوم الآخر فقد ضل ضلالا بعيدا
254,إن الذين يكفرون بالله ورسله ويريدون أن يفرقوا بين الله ورسله ويقولون نؤمن ببعض ونكفر ببعض ويريدون أن يتخذوا بين ذلك سبيلا. أولئك هم الكافرون حقا وأعتدنا للكافرين عذابا مهينا. والذين آمنوا بالله ورسله ولم يفرقوا بين أحد منهم أولئك سوف يؤتيهم أجورهم وكان الله غفورا رحيما.,هل احترم الإسلام الأنبياء؟,الذين آمنوا بالله ورسله ولم يفرقوا بين أحد منهم أولئك سوف يؤتيهم أجورهم
255,وقالوا لولا أنزل عليه ملك ولو أنزلنا ملكا لقضي الأمر ثم لا ينظرون. ولو جعلناه ملكا لجعلناه رجلا وللبسنا عليهم ما يلبسون. ولقد استهزئ برسل من قبلك فحاق بالذين سخروا منهم ما كانوا به يستهزئون. قل سيروا في الأرض ثم انظروا كيف كان عاقبة المكذبين.,هل احترم الإسلام الأنبياء؟,لقد استهزئ برسل من قبلك فحاق بالذين سخروا منهم ما كانوا به يستهزئون
256,ووهبنا له إسحاق ويعقوب كلا هدينا ونوحا هدينا من قبل ومن ذريته داوود وسليمان وأيوب ويوسف وموسى وهارون وكذلك نجزي المحسنين. وزكريا ويحيى وعيسى وإلياس كل من الصالحين. وإسماعيل واليسع ويونس ولوطا وكلا فضلنا على العالمين. ومن آبائهم وذرياتهم وإخوانهم واجتبيناهم وهديناهم إلى صراط مستقيم. ذلك هدى الله يهدي به من يشاء من عباده ولو أشركوا لحبط عنهم ما كانوا يعملون. أولئك الذين آتيناهم الكتاب والحكم والنبوة فإن يكفر بها هؤلاء فقد وكلنا بها قوما ليسوا بها بكافرين. أولئك الذين هدى الله فبهداهم اقتده قل لا أسألكم عليه أجرا إن هو إلا ذكرى للعالمين.,هل احترم الإسلام الأنبياء؟,وهبنا له إسحاق ويعقوب كلا هدينا ونوحا هدينا من قبل ومن ذريته داوود وسليمان وأيوب ويوسف وموسى وهارون وكذلك نجزي المحسنين
257,ووهبنا له إسحاق ويعقوب كلا هدينا ونوحا هدينا من قبل ومن ذريته داوود وسليمان وأيوب ويوسف وموسى وهارون وكذلك نجزي المحسنين. وزكريا ويحيى وعيسى وإلياس كل من الصالحين. وإسماعيل واليسع ويونس ولوطا وكلا فضلنا على العالمين. ومن آبائهم وذرياتهم وإخوانهم واجتبيناهم وهديناهم إلى صراط مستقيم. ذلك هدى الله يهدي به من يشاء من عباده ولو أشركوا لحبط عنهم ما كانوا يعملون. أولئك الذين آتيناهم الكتاب والحكم والنبوة فإن يكفر بها هؤلاء فقد وكلنا بها قوما ليسوا بها بكافرين. أولئك الذين هدى الله فبهداهم اقتده قل لا أسألكم عليه أجرا إن هو إلا ذكرى للعالمين.,هل احترم الإسلام الأنبياء؟,زكريا ويحيى وعيسى وإلياس كل من الصالحين
258,ووهبنا له إسحاق ويعقوب كلا هدينا ونوحا هدينا من قبل ومن ذريته داوود وسليمان وأيوب ويوسف وموسى وهارون وكذلك نجزي المحسنين. وزكريا ويحيى وعيسى وإلياس كل من الصالحين. وإسماعيل واليسع ويونس ولوطا وكلا فضلنا على العالمين. ومن آبائهم وذرياتهم وإخوانهم واجتبيناهم وهديناهم إلى صراط مستقيم. ذلك هدى الله يهدي به من يشاء من عباده ولو أشركوا لحبط عنهم ما كانوا يعملون. أولئك الذين آتيناهم الكتاب والحكم والنبوة فإن يكفر بها هؤلاء فقد وكلنا بها قوما ليسوا بها بكافرين. أولئك الذين هدى الله فبهداهم اقتده قل لا أسألكم عليه أجرا إن هو إلا ذكرى للعالمين.,هل احترم الإسلام الأنبياء؟,إسماعيل واليسع ويونس ولوطا وكلا فضلنا على العالمين
259,ولقد جاءت رسلنا إبراهيم بالبشرى قالوا سلاما قال سلام فما لبث أن جاء بعجل حنيذ. فلما رأى أيديهم لا تصل إليه نكرهم وأوجس منهم خيفة قالوا لا تخف إنا أرسلنا إلى قوم لوط. وامرأته قائمة فضحكت فبشرناها بإسحاق ومن وراء إسحاق يعقوب. قالت يا ويلتى أألد وأنا عجوز وهذا بعلي شيخا إن هذا لشيء عجيب. قالوا أتعجبين من أمر الله رحمت الله وبركاته عليكم أهل البيت إنه حميد مجيد. فلما ذهب عن إبراهيم الروع وجاءته البشرى يجادلنا في قوم لوط. إن إبراهيم لحليم أواه منيب. يا إبراهيم أعرض عن هذا إنه قد جاء أمر ربك وإنهم آتيهم عذاب غير مردود.,هل احترم الإسلام الأنبياء؟,إن إبراهيم لحليم أواه منيب
260,كذلك أرسلناك في أمة قد خلت من قبلها أمم لتتلو عليهم الذي أوحينا إليك وهم يكفرون بالرحمن قل هو ربي لا إله إلا هو عليه توكلت وإليه متاب. ولو أن قرآنا سيرت به الجبال أو قطعت به الأرض أو كلم به الموتى بل لله الأمر جميعا أفلم ييأس الذين آمنوا أن لو يشاء الله لهدى الناس جميعا ولا يزال الذين كفروا تصيبهم بما صنعوا قارعة أو تحل قريبا من دارهم حتى يأتي وعد الله إن الله لا يخلف الميعاد. ولقد استهزئ برسل من قبلك فأمليت للذين كفروا ثم أخذتهم فكيف كان عقاب. أفمن هو قائم على كل نفس بما كسبت وجعلوا لله شركاء قل سموهم أم تنبئونه بما لا يعلم في الأرض أم بظاهر من القول بل زين للذين كفروا مكرهم وصدوا عن السبيل ومن يضلل الله فما له من هاد. لهم عذاب في الحياة الدنيا ولعذاب الآخرة أشق وما لهم من الله من واق.,هل احترم الإسلام الأنبياء؟,لقد استهزئ برسل من قبلك فأمليت للذين كفروا ثم أخذتهم فكيف كان عقاب
261,وقل لعبادي يقولوا التي هي أحسن إن الشيطان ينزغ بينهم إن الشيطان كان للإنسان عدوا مبينا. ربكم أعلم بكم إن يشأ يرحمكم أو إن يشأ يعذبكم وما أرسلناك عليهم وكيلا. وربك أعلم بمن في السماوات والأرض ولقد فضلنا بعض النبيين على بعض وآتينا داوود زبورا. قل ادعوا الذين زعمتم من دونه فلا يملكون كشف الضر عنكم ولا تحويلا.,هل احترم الإسلام الأنبياء؟,لقد فضلنا بعض النبيين على بعض
